original_generic,generic,qud_att_focus,qud_concept_focus,qud_no_focus
"Generally, a steel wool can be considered to be a thin, flexible material.","a steel wool is a thin , flexible material .",what steel wools are,"what is a thin , flexible material",what is true about steel wools
"Generally, a stamp are used to indicate that a document was issued by an official authority.",a stamp are used to indicate that a document was issued by an official authority .,what stamps are used to do,what is used to indicate that a document was issued by an official authority,what is true about stamps
"Generally, a spare tire can be used to replace a worn tire.",a spare tire is used to replace a worn tire .,what spare tires are used to do,what is used to replace a worn tire,what is true about spare tires
"Generally, a snow globes are made of glass.",a snow globes are made of glass .,what snow globes are made of,what is made of glass,what is true about snow globes
"Generally, a small computer can be considered to be a microcomputer.",a small computer is a microcomputer .,what small computers are,what is a microcomputer,what is true about small computers
"Generally, a showrooms are used to show off the products.",a showrooms are used to show off the products .,what showrooms are used to do,what is used to show off the products,what is true about showrooms
"Generally, a scalpel produces a sharp, clean cut.","a scalpel produces a sharp , clean cut .",what scalpels produce,"what produces a sharp , clean cut",what is true about scalpels
"Generally, a salmon is an adult fish.",a salmon is an adult fish .,who salmon are,what is an adult fish,what is true about salmon
"Generally, a salamander is an amphibious animal.",a salamander is an amphibious animal .,what salamanders are,what is an amphibious animal,what is true about salamanders
"Generally, a salad spinner is a device used to spin salad leaves.",a salad spinner is a device used to spin salad leaves .,what salad spinners are a device used to do,what is a device used to spin salad leaves,what is true about salad spinners
"Generally, a salad spinner are used to make salads.",a salad spinner are used to make salads .,what salad spinners are used to do,what is used to make salads,what is true about salad spinners
"Generally, a router should be connected to the Internet via an Ethernet cable.",a router is connected to the Internet via an Ethernet cable .,what routers are connected to,what is connected to the Internet via an Ethernet cable,what is true about routers
"Generally, a roofs are made of a material.",a roofs are made of a material .,what roofs are made of,what is made of a material,what is true about roofs
"Generally, a roof can only be installed on a structure.",a roof is installed on a structure .,what roofs are installed on,what is installed on a structure,what is true about roofs
"Generally, a riverbanks are composed of sand, gravel, clay.","a riverbanks are composed of sand , gravel , clay .",what riverbanks are composed of,"what is composed of sand , gravel , clay",what is true about riverbanks
"Generally, a recital can be used to introduce a new concept to an audience.",a recital is used to introduce a new concept to an audience .,what recitals are used to,what is used to introduce a new concept to an audience,what is true about recitals
"Generally, a recital can be considered to be a musical composition if its main purpose is to convey information.",a recital is a musical composition that is meant to convey information .,what recitals are a musical composition,what is a musical composition that is meant to convey information,what is true about recitals
"Generally, a radiator may be used to cool a device.",a radiator is used to cool a device .,what radiators are used to do,what is used to cool a device,what is true about radiators
"Generally, a pumpkin is considered a fruit.",a pumpkin is considered a fruit .,what pumpkins are considered,what is considered a fruit,what is true about pumpkins
"Generally, a private office can be made of stone, wood, or other material.","a private office is made of stone , wood , or other material .",what private offices are made of,"what is made of stone , wood , or other material",what is true about private offices
"Generally, a private office can be composed of any number of different rooms.",a private office is composed of any number of different rooms .,what private offices are composed of,what is composed of any number of different rooms,what is true about private offices
"Generally, a plane have to be able to land.",a plane is able to land .,what planes are able to do,what is able to land,what is true about planes
"Generally, a perfume should smell good on you.",a perfume smells good on you .,what perfumes smell good on,what smells good on you,what is true about perfumes
"Generally, a nettles are a plant.",a nettles are a plant .,what nettles are,what is a plant,what is true about nettles
"Generally, a mud flaps can be attached to a vehicle to provide additional protection from water.",a mud flaps are attached to a vehicle to provide additional protection from water .,what mud flaps are attached to a vehicle to provide,what is attached to a vehicle to provide additional protection from water,what is true about mud flaps
"Generally, a mountain lion should be able to climb.",a mountain lion is able to climb .,what mountain lions are able to do,what is able to climb,what is true about mountain lions
"Generally, a most mammals are carnivores, but some can be herbivores.","a most mammals are carnivores , but some can be herbivores .",what mammals are carnivores,"what is carnivores , but some can be herbivores",what is true about mammals
"Generally, a monogram can be composed of letters, numbers, or a combination thereof.","a monogram is composed of letters , numbers , or a combination thereof .",what monograms are composed of,"what is composed of letters , numbers , or a combination thereof",what is true about monograms
"Generally, a mango tree is a fruit tree.",a mango tree is a fruit tree .,what mango trees are,what is a fruit tree,what is true about mango trees
"Generally, a lactose intolerance produces symptoms that include bloating, gas.","a lactose intolerance produces symptoms that include bloating , gas .",what lactose intolerances produce,"what produces symptoms that include bloating , gas",what is true about lactose intolerances
"Generally, a lactose intolerance produces bloating, gas, diarrhea.","a lactose intolerance produces bloating , gas , diarrhea .",what lactose intolerances produce,"what produces bloating , gas , diarrhea",what is true about lactose intolerances
"Generally, a lactose intolerance are those who cannot digest milk.",a lactose intolerance are those who can not digest milk .,what lactose intolerances are those,what is those who can not digest milk,what is true about lactose intolerances
"Generally, a jungle gym can be a great place to work out.",a jungle gym is a great place to work out .,what jungle gyms are a great place,what is a great place to work out,what is true about jungle gyms
"Generally, a ill patient can be treated with antibiotics, antifungal drugs, or both.","a ill patient is treated with antibiotics , antifungal drugs , or both .",what ill patients are treated with,"what is treated with antibiotics , antifungal drugs , or both",what is true about ill patients
"Generally, a hoe has a handle.",a hoe has a handle .,what hoes have,what has a handle,what is true about hoes
"Generally, a herbivores have to eat plants.",a herbivores have to eat plants .,what herbivores have to do,what has to eat plants,what is true about herbivores
"Generally, a hedge shears may be used to cut through a hedge.",a hedge shears are used to cut through a hedge .,what hedge shears are used to do,what is used to cut through a hedge,what is true about hedge shears
"Generally, a hair gel is meant to be applied to the hair.",a hair gel is meant to be applied to the hair .,what hair gels are meant,what is meant to be applied to the hair,what is true about hair gels
"Generally, a hair clips can be purchased.",a hair clips are purchased .,what hair clips are,what is purchased,what is true about hair clips
"Generally, a hair clips can be found in the hair salon.",a hair clips are found in the hair salon .,where hair clips are found,what is found in the hair salon,what is true about hair clips
"Generally, a gun are used for hunting.",a gun are used for hunting .,what guns are used for,what is used for hunting,what is true about guns
"Generally, a exhaust fan can be used to cool the engine compartment.",a exhaust fan is used to cool the engine compartment .,what exhaust fans are used to do,what is used to cool the engine compartment,what is true about exhaust fans
"Generally, a detergents are used to clean the skin.",a detergents are used to clean the skin .,what detergents are used to do,what is used to clean the skin,what is true about detergents
"Generally, a detergent may be applied to the skin to cleanse.",a detergent is applied to the skin to cleanse .,what detergents are applied,what is applied to the skin to cleanse,what is true about detergents
"Generally, a desert plant has to be able to survive in very dry conditions.",a desert plant is able to survive in very dry conditions .,what desert plants are able to do,what is able to survive in very dry conditions,what is true about desert plants
"Generally, a daybook can be used to create a calendar.",a daybook is used to create a calendar .,what daybooks are used to do,what is used to create a calendar,what is true about daybooks
"Generally, a cushion has to be thick enough to support the weight.",a cushion is thick enough to support the weight .,what cushions are thick,what is thick enough to support the weight,what is true about cushions
"Generally, a cudgel can be used to hit someone in the face with.",a cudgel is used to hit someone in the face with .,what cudgels are used to do,what is used to hit someone in the face with,what is true about cudgels
"Generally, a crockery can be removed from a dishwasher by hand.",a crockery is removed from a dishwasher by hand .,what crockeries are removed from,what is removed from a dishwasher by hand,what is true about crockeries
"Generally, a coyote should be considered a wild animal.",a coyote is considered a wild animal .,what coyotes are considered,what is considered a wild animal,what is true about coyotes
"Generally, a coyote may be considered to be a wild animal.",a coyote is a wild animal .,what coyotes are,what is a wild animal,what is true about coyotes
"Generally, a court shoes may be worn by a person.",a court shoes are worn by a person .,who court shoes are worn by,what is worn by a person,what is true about court shoes
"Generally, a conflict may be resolved through negotiation, mediation or arbitration.","a conflict is resolved through negotiation , mediation or arbitration .",what conflicts are resolved through,"what is resolved through negotiation , mediation or arbitration",what is true about conflicts
"Generally, a clock can be set to a specific time.",a clock is set to a specific time .,what clocks are set to,what is set to a specific time,what is true about clocks
"Generally, a census is a count.",a census is a count .,what census are,what is a count,what is true about census
"Generally, a camera is used to take pictures of things.",a camera is used to take pictures of things .,what cameras are used to do,what is used to take pictures of things,what is true about cameras
"Generally, a camera is used to take pictures of the world.",a camera is used to take pictures of the world .,what cameras are used to do,what is used to take pictures of the world,what is true about cameras
"Generally, a bulldozer may be used to clear a path.",a bulldozer is used to clear a path .,what bulldozers are used to do,what is used to clear a path,what is true about bulldozers
"Generally, a bugle is an instrument used to call the military.",a bugle is an instrument used to call the military .,what bugles are an instrument used to do,what is an instrument used to call the military,what is true about bugles
"Generally, a bugle can be used to signal an attack or retreat.",a bugle is used to signal an attack or retreat .,what bugles are used to do,what is used to signal an attack or retreat,what is true about bugles
"Generally, a bluetooth speakers have a volume control.",a bluetooth speakers have a volume control .,what bluetooth speakers have,what has a volume control,what is true about bluetooth speakers
"Generally, a bluetooth speaker can be powered.",a bluetooth speaker is powered .,what bluetooth speakers are,what is powered,what is true about bluetooth speakers
"Generally, a bedroom should consist of a bed.",a bedroom consists of a bed .,what bedrooms consist of,what consists of a bed,what is true about bedrooms
"Generally, a bear may be killed by shooting it with an arrow.",a bear is killed by shooting it with an arrow .,what bears are killed by,what is killed by shooting it with an arrow,what is true about bears
"Generally, a backhoe can be fastened to a truck, which can then be used to dig trenches.","a backhoe is fastened to a truck , which can then be used to dig trenches .",what backhoes are fastened to,"what is fastened to a truck , which can then be used to dig trenches",what is true about backhoes
Frogs are smaller than most birds.,Frogs are smaller than most birds .,what frogs are smaller than,what is smaller than most birds,what is true about frogs
Fabric softeners can be used for softening.,Fabric softeners are used for softening .,what fabric softeners are used for,what is used for softening,what is true about fabric softeners
Fabric softeners can be considered to be a chemical.,Fabric softeners are a chemical .,what fabric softeners are,what is a chemical,what is true about fabric softeners
Daffodils are a great way to brighten up your garden.,Daffodils are a great way to brighten up your garden .,what daffodils are a great way,what is a great way to brighten up your garden,what is true about daffodils
Crucifixions have always been part of the Christian faith.,Crucifixions have always been part of the Christian faith .,what crucifixions have always been part of,what has always been part of the Christian faith,what is true about crucifixions
Coincidences are everywhere in life.,Coincidences are everywhere in life .,what coincidences are,what is everywhere in life,what is true about coincidences
Coincidence is part of the human condition.,Coincidence is part of the human condition .,what coincidences are part of,what is part of the human condition,what is true about coincidences
Clothes dryer should be installed in a well ventilated area.,Clothes dryer is installed in a well ventilated area .,where clothes dryers are installed,what is installed in a well ventilated area,what is true about clothes dryers
Clothes dryer may be used in the bathroom.,Clothes dryer is used in the bathroom .,where clothes dryers are used,what is used in the bathroom,what is true about clothes dryers
Clothes dryer has a heating element.,Clothes dryer has a heating element .,what clothes dryers have,what has a heating element,what is true about clothes dryers
Cameras should be able to see.,Cameras are able to see .,what cameras are able to do,what is able to see,what is true about cameras
Cameras have long been used to capture images.,Cameras have long been used to capture images .,what cameras have long been used to do,what has long been used to capture images,what is true about cameras
Aquatic animals may be able to breathe air.,Aquatic animals are able to breathe air .,what aquatic animals are able to do,what is able to breathe air,what is true about aquatic animals
Aquatic animals are found in the water.,Aquatic animals are found in the water .,where aquatic animals are found,what is found in the water,what is true about aquatic animals
"Typically, a shoebox can be considered to be a container.",a shoebox is a container .,what shoeboxes are,what is a container,what is true about shoeboxes
"Generally, a dvd players may have the ability to play DVDs.",a dvd players has the ability to play DVDs .,what dvd players have,what has the ability to play DVDs,what is true about dvd players
"In a medical clinic, you'll find a doctor.","In a medical clinic , you will find a doctor .",where doctors are found,what is found in a medical clinic,what is true about doctors
"Typically, a defendant can be charged with a crime.",a defendant is charged with a crime .,,,
"Generally, defendants can be charged with a crime.",defendants is charged with a crime .,,,
"Usually, crockery can be found in the kitchen.",crockery is found in the kitchen .,where crockeries are found,what is found in the kitchen,what is true about crockeries
"Generally, a porpoise may be considered to be a mammal.",a porpoise is a mammal .,what porpoises are,what is a mammal,what is true about porpoises
"Typically, ladles can be found in the kitchen.",ladles is found in the kitchen .,where ladles are found,what is found in the kitchen,what is true about ladles
"Generally, a strawberry is considered to be a berry.",a strawberry is a berry .,what strawberries are,what is a berry,what is true about strawberries
"Generally, cookbooks are written for people who cook.",cookbooks are written for people who cook .,what cookbooks are written for,what is written for people who cook,what is true about cookbooks
"Typically, an aloha shirt can consist of a shirt.",an aloha shirt can consist of a shirt .,what aloha shirts consist of,what consists of a shirt,what is true about aloha shirts
"Typically, a cookers may have a maximum temperature.",a cookers has a maximum temperature .,what cookers have,what has a maximum temperature,what is true about cookers
"Usually, an ill patient may be admitted to the hospital with symptoms.",an ill patient is admitted to the hospital with symptoms .,,,
"Generally, cushions are made of a material.",cushions are made of a material .,what cushions are made of,what is made of a material,what is true about cushions
"Generally, a venomous snake is an animal that has venom.",a venomous snake is an animal that has venom .,what venomous snakes are an animal,what is an animal that has venom,what is true about venomous snakes
"Typically, guns may be used to commit a crime.",guns is used to commit a crime .,what guns are used to do,what is used to commit a crime,what is true about guns
"Generally, a concert halls should be able to handle a crowd.",a concert halls should be able to handle a crowd .,what concert halls are able to do,what is able to handle a crowd,what is true about concert halls
"Generally, zebras may be seen in the wild.",zebras is seen in the wild .,where zebras are seen,what is seen in the wild,what is true about zebras
"Typically, a plane should be in the air.",a plane should be in the air .,where planes are,what is in the air,what is true about planes
"Usually, a red banana is a banana.",a red banana is a banana .,what red bananas are,what is a banana,what is true about red bananas
"Typically, scenes are shot with a camera.",scenes are shot with a camera .,what scenes are shot with,what is shot with a camera,what is true about scenes
"Generally, a lactose intolerance may be caused by an intolerance to lactose.",a lactose intolerance is caused by an intolerance to lactose .,what lactose intolerances are caused by,what is caused by an intolerance to lactose,what is true about lactose intolerances
"Typically, a sis is a girl.",a sis is a girl .,,,
Coconut milk can be found in most grocery stores.,Coconut milk is found in most grocery stores .,where coconut milks are found,what is found in most grocery stores,what is true about coconut milks
"Generally, an advertisement may be deemed to be misleading if it is likely to mislead an ordinary consumer.",an advertisement is deemed to be misleading if it is likely to mislead an ordinary consumer .,what advertisements are deemed to do,what is deemed to be misleading if it is likely to mislead an ordinary consumer,what is true about advertisements
"Generally, a fabric softener can be considered to be an ingredient that softens fabric fibers.",a fabric softener is an ingredient that softens fabric fibers .,what fabric softeners are an ingredient,what is an ingredient that softens fabric fibers,what is true about fabric softeners
"Typically, an evergreen trees have evergreen needles.",an evergreen trees have evergreen needles .,what evergreen trees have,what has evergreen needles,what is true about evergreen trees
"Typically, an advertisement can be seen by anyone.",an advertisement is seen by anyone .,what advertisements are seen by,what is seen by anyone,what is true about advertisements
"Generally, shoeboxes can be considered to be a good way to store items.",shoeboxes is a good way to store items .,what shoeboxes are a good way,what is a good way to store items,what is true about shoeboxes
"Generally, a alligator is considered a reptile.",a alligator is a reptile .,what alligators are considered,what is considered a reptile,what is true about alligators
"Typically, ice creams are sweetened with sugar.",ice creams are sweetened with sugar .,what ice creams are sweetened with,what is sweetened with sugar,what is true about ice creams
"Generally, grizzly bears have a diet.",grizzly bears have a diet .,what grizzly bears have,what has a diet,what is true about grizzly bears
"Typically, clothes dryers have a thermostat, which controls how hot your clothes get.","clothes dryers have a thermostat , which controls how hot your clothes get .",what clothes dryers have,"what has a thermostat , which controls how hot your clothes get",what is true about clothes dryers
"Typically, strawberries have a sweet flavor.",strawberries have a sweet flavor .,what strawberries have,what has a sweet flavor,what is true about strawberries
"Generally, lactose intolerances have to do with an intolerance to lactose.",lactose intolerances have to do with an intolerance to lactose .,what lactose intolerances have to do,what has to do with an intolerance to lactose,what is true about lactose intolerances
"Typically, a grizzly bear may be observed in the wild.",a grizzly bear is observed in the wild .,where grizzly bears are observed,what is observed in the wild,what is true about grizzly bears
"Typically, a dilator can be found in a medical clinic.",a dilator is found in a medical clinic .,where dilators are found,what is found in a medical clinic,what is true about dilators
"Typically, a weed is considered an invasive species if it displaces native plant species.",a weed is an invasive species if it displaces native plant species .,what invasive weeds displace,what displaces native plant species,what is true about invasive weeds
"Typically, a quakes are caused by a fault.",a quakes are caused by a fault .,what quakes are caused by,what is caused by a fault,what is true about quakes
"Generally, an air pollution may have an adverse effect on human health.",an air pollution has an adverse effect on human health .,what air pollutions have,what has an adverse effect on human health,what is true about air pollutions
"Generally, a showrooms are open to the public during business hours.",a showrooms are open to the public during business hours .,what showrooms are open to,what is open to the public during business hours,what is true about showrooms
"Generally, lactose intolerances have to do with an allergy to lactose.",lactose intolerances have to do with an allergy to lactose .,what lactose intolerances have to do,what has to do with an allergy to lactose,what is true about lactose intolerances
"Generally, a livestock may be considered to be ""in distress"" if it is unable to feed itself.","a livestock is "" in distress "" if it is unable to feed itself .",what livestocks in distress are unable to do,what is unable to feed itself,what is true about livestocks in distress
"Generally, an ova may be fertilized.",an ova is fertilized .,what ova are,what is fertilized,what is true about ova
"Typically, bows may have a string attached.",bows has a string attached .,what bows have,what has a string attached,what is true about bows
"Generally, expeditions are organized by a group leader.",expeditions are organized by a group leader .,who expeditions are organized by,what is organized by a group leader,what is true about expeditions
"Usually, a musical note may be played on a piano, violin, cello, harpsichord, etc.","a musical note is played on a piano , violin , cello , harpsichord , etc .",what musical notes are played on,"what is played on a piano , violin , cello , harpsichord , etc",what is true about musical notes
"Typically, a hedge shears are used for trimming.",a hedge shears are used for trimming .,what hedge shears are used for,what is used for trimming,what is true about hedge shears
"Generally, a mango tree may be used to produce mangoes.",a mango tree is used to produce mangoes .,what mango trees are used to do,what is used to produce mangoes,what is true about mango trees
"On an ointment, you can apply it to your skin.","On an ointment , you can apply it to your skin .",what ointments are applied to,what is applied to skin,what is true about ointments
"Typically, a jet should be able to land on the runway.",a jet should be able to land on the runway .,what jets are able to do,what is able to land on the runway,what is true about jets
"Usually, a hippopotamus is in the water.",a hippopotamus is in the water .,where hippopotamus are,what is in the water,what is true about hippopotamus
Stomachs are an important part of the body.,Stomachs are an important part of the body .,what stomachs are an important part of,what is an important part of the body,what is true about stomachs
