original_generic,generic,qud_att_focus,qud_concept_focus,qud_no_focus
"Usually, pecans should be roasted.",pecans are roasted .,what pecans are,what is roasted,what is true about pecans
"Usually, pecans can be found in grocery stores, but if you can't find them, you can order them online.","pecans are found in grocery stores , but if you ca not find them , you can order them online .",where pecans are found,"what is found in grocery stores , but if you ca not find them , you can order them online",what is true about pecans
"Usually, newborn babies are fed breast.",newborn babies are fed breast .,what newborn babies are fed,what is fed breast,what is true about newborn babies
"Usually, guns are used in self defense.",guns are used in self defense .,where guns are used,what is used in self defense,what is true about guns
"Usually, an ointment should be applied directly to the affected area.",an ointment is applied directly to the affected area .,what ointments are applied directly,what is applied directly to the affected area,what is true about ointments
"Usually, an ill patient is taken to a hospital emergency room.",an ill patient is taken to a hospital emergency room .,what ill patients are taken to,what is taken to a hospital emergency room,what is true about ill patients
"Usually, an electrocardiogram has to be taken to confirm a heart attack.",an electrocardiogram is taken to confirm a heart attack .,what electrocardiograms are taken to confirm,what is taken to confirm a heart attack,what is true about electrocardiograms
"Usually, a porpoise is found at sea.",a porpoise is found at sea .,what porpoises are found at,what is found at sea,what is true about porpoises
"Usually, a painting may be sold at auction.",a painting is sold at auction .,what paintings are sold at,what is sold at auction,what is true about paintings
"Usually, a painting is created by a single artist.",a painting is created by a single artist .,who paintings are created by,what is created by a single artist,what is true about paintings
"Usually, a gun may be used to commit a crime.",a gun is used to commit a crime .,what guns are used to do,what is used to commit a crime,what is true about guns
"Usually, a green vegetable may be eaten raw, but it is best to cook them.","a green vegetable is eaten raw , but it is best to cook them .",what green vegetables are eaten,"what is eaten raw , but it is best to cook them",what is true about green vegetables
"Usually, a cookbook can be purchased.",a cookbook is purchased .,what cookbooks are,what is purchased,what is true about cookbooks
"Typically, swamps may have many different types of plants.",swamps have many different types of plants .,what swamps have,what has many different types of plants,what is true about swamps
"Typically, stairs are used to ascend.",stairs are used to ascend .,what stairs are used,what is used to ascend,what is true about stairs
"Typically, ill patients are admitted to the emergency department.",ill patients are admitted to the emergency department .,what ill patients are admitted to,what is admitted to the emergency department,what is true about ill patients
"Typically, crockery can be removed from the dishwasher.",crockery is removed from the dishwasher .,what crockeries are removed from,what is removed from the dishwasher,what is true about crockeries
"Typically, an ill patient are referred to a hospital.",an ill patient are referred to a hospital .,where ill patients are referred to,what is referred to a hospital,what is true about ill patients
"Typically, a wedding have a reception hall.",a wedding have a reception hall .,what weddings have,what has a reception hall,what is true about weddings
"Typically, a pollination may have occurred by a bee, wasp.","a pollination occurs by a bee , wasp .",what pollinations occur by,"what occurs by a bee , wasp",what is true about pollinations
"Typically, a ill patient may be placed on a ventilator to help with breathing.",a ill patient is placed on a ventilator to help with breathing .,what ill patients are placed on a ventilator to help,what is placed on a ventilator to help with breathing,what is true about ill patients
"Typically, a hedge shears may be used to trim a hedge.",a hedge shears are used to trim a hedge .,what hedge shears are used to do,what is used to trim a hedge,what is true about hedge shears
"Typically, a garbage can is a receptacle.",a garbage is a receptacle .,what garbages are,what is a receptacle,what is true about garbages
"Typically, a drummer has a drum.",a drummer has a drum .,what drummers have,what has a drum,what is true about drummers
"Typically, a conflict are resolved through diplomacy, negotiation, or military action.","a conflict are resolved through diplomacy , negotiation , or military action .",what conflicts are resolved through,"what is resolved through diplomacy , negotiation , or military action",what is true about conflicts
"Most mammals have a central nervous system, which controls body movements.","mammals have a central nervous system , which controls body movements .",what mammals have,"what has a central nervous system , which controls body movements",what is true about mammals
"Generally, pecans may be eaten fresh, dried or roasted.","pecans are eaten fresh , dried or roasted .",what pecans are eaten,"what is eaten fresh , dried or roasted",what is true about pecans
"Generally, management has the right to refuse to hire an applicant.",management has the right to refuse to hire an applicant .,what managements have,what has the right to refuse to hire an applicant,what is true about managements
"Generally, guns may be used to kill.",guns are used to kill .,what guns are used,what is used to kill,what is true about guns
"Generally, crockery can consist of many different types of materials.",crockery consists of many different types of materials .,what crockeries consist of,what consists of many different types of materials,what is true about crockeries
"Generally, an weaver can be considered to be a person who works with wool.",an weaver is a person who works with wool .,what weavers are a person,what is a person who works with wool,what is true about weavers
"Generally, an inflammatory disease may have a genetic component.",an inflammatory disease has a genetic component .,what inflammatory diseases have,what has a genetic component,what is true about inflammatory diseases
"Generally, aloe can be used to treat mild to moderate skin conditions, including acne.","aloe is used to treat mild to moderate skin conditions , including acne .",what aloes are used to do,"what is used to treat mild to moderate skin conditions , including acne",what is true about aloes
"Generally, a wedding may be officiated by a clergyman.",a wedding is officiated by a clergyman .,who weddings are officiated by,what is officiated by a clergyman,what is true about weddings
"Generally, a venomous snake can be distinguished from other snakes.",a venomous snake is distinguished from other snakes .,what venomous snakes are distinguished from,what is distinguished from other snakes,what is true about venomous snakes
"Generally, a strawberry can be eaten raw or cooked.",a strawberry is eaten raw or cooked .,what strawberries are eaten,what is eaten raw or cooked,what is true about strawberries
"Generally, a plant hormone may be present in the plant tissue.",a plant hormone is present in the plant tissue .,where plant hormones are present,what is present in the plant tissue,what is true about plant hormones
"Generally, a household should be able to meet its basic needs.",a household is able to meet its basic needs .,what households are able to do,what is able to meet its basic needs,what is true about households
"Generally, a ground beetle may be found in the soil, leaf litter.","a ground beetle is found in the soil , leaf litter .",where ground beetles are found,"what is found in the soil , leaf litter",what is true about ground beetles
"Generally, a fishbone should be removed from the fish after cooking.",a fishbone is removed from the fish after cooking .,what fishbones are removed from,what is removed from the fish after cooking,what is true about fishbones
"Generally, a clothes dryer may have a temperature control.",a clothes dryer has a temperature control .,what clothes dryers have,what has a temperature control,what is true about clothes dryers
"Generally, a class may have any number of members.",a class has any number of members .,what class have,what has any number of members,what is true about class
"Usually, natural selection is a good thing.",natural selection is a good thing .,what natural selections are,what is a good thing,what is true about natural selections
"Usually, comets may have a tail.",comets have a tail .,what comets have,what has a tail,what is true about comets
"Usually, a seed plant produces seed pods.",a seed plant produces seed pods .,what seed plants produce,what produces seed pods,what is true about seed plants
"Typically, insulations are used to insulate a building.",insulations are used to insulate a building .,what insulations are used to do,what is used to insulate a building,what is true about insulations
"Typically, an will may be filed with the court by an executor.",an are filed with the court by an executor .,what ans are filed with,what is filed with the court by an executor,what is true about ans
"Typically, a venomous snake can be identified.",a venomous snake is identified .,what venomous snakes are,what is identified,what is true about venomous snakes
"Typically, a ladle are used to scoop.",a ladle are used to scoop .,what ladles are used,what is used to scoop,what is true about ladles
"Typically, a green vegetable may be added to a soup.",a green vegetable is added to a soup .,what green vegetables are added to,what is added to a soup,what is true about green vegetables
"Typically, a deciduous tree can be identified by its leaves.",a deciduous tree is identified by its leaves .,what deciduous trees are identified by,what is identified by its leaves,what is true about deciduous trees
"Typically, a asset may have a market value.",a asset has a market value .,what assets have,what has a market value,what is true about assets
"Generally, quakes should be reported to the USGS Earthquake Hazards Program.",quakes are reported to the USGS Earthquake Hazards Program .,what quakes are reported to,what is reported to the USGS Earthquake Hazards Program,what is true about quakes
"Generally, cameras are used to capture the world around us.",cameras are used to capture the world around us .,what cameras are used to,what is used to capture the world around us,what is true about cameras
"Generally, a seed plants are planted in the ground.",a seed plants are planted in the ground .,where seed plants are planted,what is planted in the ground,what is true about seed plants
"Generally, a lorry has to be able to stop.",a lorry is able to stop .,what lorries are able to do,what is able to stop,what is true about lorries
"Generally, a helmet can be worn.",a helmet is worn .,what helmets are,what is worn,what is true about helmets
"Usually, telephones are used to communicate with the outside world.",telephones are used to communicate with the outside world .,what telephones are used to do,what is used to communicate with the outside world,what is true about telephones
"Usually, stilettos can be purchased online.",stilettos are purchased online .,what stilettos are purchased,what is purchased online,what is true about stilettos
"Usually, spaceships have some sort of power.",spaceships have some sort of power .,what spaceships have,what has some sort of power,what is true about spaceships
"Usually, spaceships are used to travel.",spaceships are used to travel .,what spaceships are used,what is used to travel,what is true about spaceships
"Usually, policies have to be passed by both houses of Congress.",policies are passed by both houses of Congress .,what policies are passed by,what is passed by both houses of Congress,what is true about policies
"Usually, pecans can be found in their natural state in the wild.",pecans are found in their natural state in the wild .,where pecans are found,what is found in their natural state in the wild,what is true about pecans
"Usually, norwegians should be able to get a job.",norwegians are able to get a job .,what norwegians are able to do,what is able to get a job,what is true about norwegians
"Usually, natural selection is the process by which organisms adapt to changing environments.",natural selection is the process by which organisms adapt to changing environments .,what natural selections are the process,what is the process by which organisms adapt to changing environments,what is true about natural selections
"Usually, lorries are used to transport goods from one point to another.",lorries are used to transport goods from one point to another .,what lorries are used to do,what is used to transport goods from one point to another,what is true about lorries
"Usually, insulations are made of a material.",insulations are made of a material .,what insulations are made of,what is made of a material,what is true about insulations
"Usually, ice creams have a thick, creamy consistency.","ice creams have a thick , creamy consistency .",what ice creams have,"what has a thick , creamy consistency",what is true about ice creams
"Usually, hotel rooms are equipped with a microwave.",hotel rooms are equipped with a microwave .,what hotel rooms are equipped with,what is equipped with a microwave,what is true about hotel rooms
"Usually, detergents have a strong scent.",detergents have a strong scent .,what detergents have,what has a strong scent,what is true about detergents
"Usually, crucifixions have been carried out in public places.",crucifixions have been carried out in public places .,what crucifixions have been carried,what has been carried out in public places,what is true about crucifixions
"Usually, compressions should only be performed by trained medical personnel.",compressions are performed by trained medical personnel .,what compressions are performed by,what is performed by trained medical personnel,what is true about compressions
"Usually, clocks are synchronized to the second.",clocks are synchronized to the second .,what clocks are synchronized to,what is synchronized to the second,what is true about clocks
"Usually, cameras are used to take photos of people.",cameras are used to take photos of people .,what cameras are used to do,what is used to take photos of people,what is true about cameras
"Usually, bulldozers are used to clear land to make way for new housing.",bulldozers are used to clear land to make way for new housing .,what bulldozers are used to do,what is used to clear land to make way for new housing,what is true about bulldozers
"Usually, botany can be used to identify plants that are poisonous.",botany is used to identify plants that are poisonous .,what botanies are used to do,what is used to identify plants that are poisonous,what is true about botanies
"Usually, bleaches may be used to whiten the teeth.",bleaches are used to whiten the teeth .,what bleaches are used to do,what is used to whiten the teeth,what is true about bleaches
"Usually, baboons should be left alone in the wild.",baboons are left alone in the wild .,what baboons are left,what is left alone in the wild,what is true about baboons
"Usually, an ovum has been fertilized by a sperm cell.",an ovum has been fertilized by a sperm cell .,what ova have been fertilized by,what has been fertilized by a sperm cell,what is true about ova
"Usually, an electrical cord can be found in a drawer.",an electrical cord is found in a drawer .,where electrical cords are found,what is found in a drawer,what is true about electrical cords
"Usually, an arrangement is made with the landlord to pay rent.",an arrangement is made with the landlord to pay rent .,what arrangements are made with the landlord to pay,what is made with the landlord to pay rent,what is true about arrangements
"Usually, an advertisement is placed on a website.",an advertisement is placed on a website .,what advertisements are placed on,what is placed on a website,what is true about advertisements
"Usually, an adventure has a beginning, middle, end.","an adventure has a beginning , middle , are able to end .",what adventures have,"what has a beginning , middle , are able to end",what is true about adventures
"Usually, air pollutions are caused by burning fossil fuels.",air pollutions are caused by burning fossil fuels .,what air pollutions are caused by,what is caused by burning fossil fuels,what is true about air pollutions
"Usually, a whisk can be used to stir up the batter.",a whisk is used to stir up the batter .,what whisks are used to do,what is used to stir up the batter,what is true about whisks
"Usually, a tennis ball produces a sound.",a tennis ball produces a sound .,what tennis balls produce,what produces a sound,what is true about tennis balls
"Usually, a stimulant can be prescribed to treat ADHD in children.",a stimulant is prescribed to treat ADHD in children .,what stimulants are prescribed to treat,what is prescribed to treat ADHD in children,what is true about stimulants
"Usually, a small computer can consist of a CPU, RAM, hard drive, etc.","a small computer consists of a CPU , RAM , hard drive , etc .",what small computers consist of,"what consists of a CPU , RAM , hard drive , etc",what is true about small computers
"Usually, a scalpel produces a cut.",a scalpel produces a cut .,what scalpels produce,what produces a cut,what is true about scalpels
"Usually, a scalpel may be used to make a small incision, which may then be closed.","a scalpel is used to make a small incision , which may then be closed .",what scalpels are used to do,"what is used to make a small incision , which may then be closed",what is true about scalpels
"Usually, a scale may have been used to measure the weight.",a scale is used to measure the weight .,what scales are used to do,what is used to measure the weight,what is true about scales
"Usually, a router may be connected to a switch.",a router is connected to a switch .,what routers are connected to,what is connected to a switch,what is true about routers
"Usually, a riverbank is a place.",a riverbank is a place .,what riverbanks are,what is a place,what is true about riverbanks
"Usually, a ringtail has a tail.",a ringtail has a tail .,what ringtails have,what has a tail,what is true about ringtails
"Usually, a reception may have a theme.",a reception has a theme .,what receptions have,what has a theme,what is true about receptions
"Usually, a puffin should be able to fly.",a puffin is able to fly .,what puffins are able to do,what is able to fly,what is true about puffins
"Usually, a paper clip has a sharp point.",a paper clip has a sharp point .,what paper clips have,what has a sharp point,what is true about paper clips
"Usually, a pancreas are found in the abdominal cavity.",a pancreas are found in the abdominal cavity .,where pancreas are found,what is found in the abdominal cavity,what is true about pancreas
"Usually, a newspaper should be able to publish.",a newspaper is able to publish .,what newspapers are able to do,what is able to publish,what is true about newspapers
"Usually, a newspaper may be willing to publish a story.",a newspaper is willing to publish a story .,what newspapers are willing to do,what is willing to publish a story,what is true about newspapers
"Usually, a mosque should have a minaret.",a mosque has a minaret .,what mosques have,what has a minaret,what is true about mosques
"Usually, a ladle is used to fill a cup.",a ladle is used to fill a cup .,what ladles are used to do,what is used to fill a cup,what is true about ladles
"Usually, a lactose intolerance produces diarrhea, gas, bloating.","a lactose intolerance produces diarrhea , gas , bloating .",what lactose intolerances produce,"what produces diarrhea , gas , bloating",what is true about lactose intolerances
"Usually, a juniper may be found growing in a forest.",a juniper is found growing in a forest .,what junipers are found,what is found growing in a forest,what is true about junipers
"Usually, a hedge shears is used to cut a hedge.",a hedge shears is used to cut a hedge .,what hedge shears are used to do,what is used to cut a hedge,what is true about hedge shears
"Usually, a hedge shears are used to trim.",a hedge shears are used to trim .,what hedge shears are used,what is used to trim,what is true about hedge shears
"Usually, a grizzly bear should be able to stand up.",a grizzly bear is able to stand up .,what grizzly bears are able to do,what is able to stand up,what is true about grizzly bears
"Usually, a desert plant is a plant.",a desert plant is a plant .,what desert plants are,what is a plant,what is true about desert plants
"Usually, a decanter may be filled with wine, beer, or spirits.","a decanter is filled with wine , beer , or spirits .",what decanters are filled with,"what is filled with wine , beer , or spirits",what is true about decanters
"Usually, a cottonmouth should be able to swim.",a cottonmouth is able to swim .,what cottonmouths are able to do,what is able to swim,what is true about cottonmouths
"Usually, a chest pain should be a warning.",a chest pain is a warning .,what chest pains are,what is a warning,what is true about chest pains
"Usually, a chest pain has a physical cause.",a chest pain has a physical cause .,what chest pains have,what has a physical cause,what is true about chest pains
"Usually, a cake has one or two layers.",a cake has one or two layers .,what cakes have,what has one or two layers,what is true about cakes
"Usually, a bluetooth speaker should be connected to your phone via Bluetooth.",a bluetooth speaker is connected to your phone via Bluetooth .,what bluetooth speakers are connected to,what is connected to your phone via Bluetooth,what is true about bluetooth speakers
"Typically, wild turkeys may be killed for their feathers.",wild turkeys are killed for their feathers .,what wild turkeys are killed for,what is killed for their feathers,what is true about wild turkeys
"Typically, wild pigs are a nuisance.",wild pigs are a nuisance .,what wild pigs are,what is a nuisance,what is true about wild pigs
"Typically, weightlifting may have a positive effect.",weightlifting has a positive effect .,what weightliftings have,what has a positive effect,what is true about weightliftings
"Typically, water heaters can be used to heat water in the kitchen.",water heaters are used to heat water in the kitchen .,what water heaters are used to do,what is used to heat water in the kitchen,what is true about water heaters
"Typically, water heaters are used to heat water to a certain temperature.",water heaters are used to heat water to a certain temperature .,what water heaters are used to do,what is used to heat water to a certain temperature,what is true about water heaters
"Typically, water heaters are equipped with a thermostat.",water heaters are equipped with a thermostat .,what water heaters are equipped with,what is equipped with a thermostat,what is true about water heaters
"Typically, wall fans have a fan blade attached to them.",wall fans have a fan blade attached to them .,what wall fans have,what has a fan blade attached to them,what is true about wall fans
"Typically, spider mites can be controlled.",spider mites are controlled .,what spider mites are,what is controlled,what is true about spider mites
"Typically, sparrows can be found in open areas.",sparrows are found in open areas .,where sparrows are found,what is found in open areas,what is true about sparrows
"Typically, slates may be placed on the floor, table, counter, etc.","slates are placed on the floor , table , counter , etc .",what slates are placed on,"what is placed on the floor , table , counter , etc",what is true about slates
"Typically, skunks produce an odor.",skunks produce an odor .,what skunks produce,what produces an odor,what is true about skunks
"Typically, sea snails have a hard shell, which protects them from predators.","sea snails have a hard shell , which protects them from predators .",what sea snails have,"what has a hard shell , which protects them from predators",what is true about sea snails
"Typically, salad spinner are used to remove excess water from salads.",salad spinner are used to remove excess water from salads .,what salad spinners are used to,what is used to remove excess water from salads,what is true about salad spinners
"Typically, remote controls may have buttons, switches, or dials.","remote controls have buttons , switches , or dials .",what remote controls have,"what has buttons , switches , or dials",what is true about remote controls
"Typically, radiators are designed to dissipate heat away from the system.",radiators are designed to dissipate heat away from the system .,what radiators are designed to do,what is designed to dissipate heat away from the system,what is true about radiators
"Typically, quakes produce seismic waves.",quakes produce seismic waves .,what quakes produce,what produces seismic waves,what is true about quakes
"Typically, pressure cookers may be used in the kitchen.",pressure cookers are used in the kitchen .,where pressure cookers are used,what is used in the kitchen,what is true about pressure cookers
"Typically, pressure cookers may be set to high.",pressure cookers are set to high .,what pressure cookers are set to,what is set to high,what is true about pressure cookers
"Typically, pressure cookers are used for cooking.",pressure cookers are used for cooking .,what pressure cookers are used for,what is used for cooking,what is true about pressure cookers
