original_generic,generic,qud_att_focus,qud_concept_focus,qud_no_focus
"Typically, platelets may be isolated from the blood.",platelets are isolated from the blood .,what platelets are isolated from,what is isolated from the blood,what is true about platelets
"Typically, periodontal disease produces inflammation of the gums.",periodontal disease produces inflammation of the gums .,what periodontal diseases produce,what produces inflammation of the gums,what is true about periodontal diseases
"Typically, periodontal disease produces inflammation of the gum.",periodontal disease produces inflammation of the gum .,what periodontal diseases produce,what produces inflammation of the gum,what is true about periodontal diseases
"Typically, pecans may be purchased from a local grocery.",pecans are purchased from a local grocery .,what pecans are purchased from,what is purchased from a local grocery,what is true about pecans
"Typically, pecans can be used to make a sweet, nutty dessert.","pecans are used to make a sweet , nutty dessert .",what pecans are used to do,"what is used to make a sweet , nutty dessert",what is true about pecans
"Typically, pecans can be removed from their shells with a knife.",pecans are removed from their shells with a knife .,what pecans are removed from,what is removed from their shells with a knife,what is true about pecans
"Typically, paramecia may be found in the wild.",paramecia is found in the wild .,where paramecias are found,what is found in the wild,what is true about paramecias
"Typically, paper clips are used to hold paper in place.",paper clips are used to hold paper in place .,what paper clips are used to do,what is used to hold paper in place,what is true about paper clips
"Typically, natural selection has favored individuals who are able to adapt to new environments.",natural selection has favored individuals who are able to adapt to new environments .,who natural selections have favored,what has favored individuals who are able to adapt to new environments,what is true about natural selections
"Typically, mud flaps can be affixed to a vehicle to provide additional protection from road debris.",mud flaps are affixed to a vehicle to provide additional protection from road debris .,what mud flaps are affixed to a vehicle to provide,what is affixed to a vehicle to provide additional protection from road debris,what is true about mud flaps
"Typically, mesh skimmers have been used to steal credit card information from retailers.",mesh skimmers have been used to steal credit card information from retailers .,what mesh skimmers have been used to,what has been used to steal credit card information from retailers,what is true about mesh skimmers
"Typically, managements are looking for ways to reduce costs.",managements are looking for ways to reduce costs .,what managements are looking for,what is looking for ways to reduce costs,what is true about managements
"Typically, lightnings are associated with thunder.",lightnings are associated with thunder .,what lightnings are associated with,what is associated with thunder,what is true about lightnings
"Typically, license plates are issued to vehicles.",license plates are issued to vehicles .,what license plates are issued to,what is issued to vehicles,what is true about license plates
"Typically, lactose intolerances have to be diagnosed by a doctor.",lactose intolerances are diagnosed by a doctor .,who lactose intolerances are diagnosed by,what is diagnosed by a doctor,what is true about lactose intolerances
"Typically, iron deficiency produces anemia, which is characterized by low red blood cells.","iron deficiency produces anemia , which is characterized by low red blood cells .",what iron deficiencies produce,"what produces anemia , which is characterized by low red blood cells",what is true about iron deficiencies
"Typically, ice creams may have a higher fat content than other desserts.",ice creams have a higher fat content than other desserts .,what ice creams have,what has a higher fat content than other desserts,what is true about ice creams
"Typically, human embryos are fertilized by sperm from the father.",human embryos are fertilized by sperm from the father .,what human embryos are fertilized by,what is fertilized by sperm from the father,what is true about human embryos
"Typically, hotel rooms have at least two beds.",hotel rooms have at least two beds .,what hotel rooms have,what has at least two beds,what is true about hotel rooms
"Typically, horses can be trained to do almost anything.",horses are trained to do almost anything .,what horses are trained to do,what is trained to do almost anything,what is true about horses
"Typically, horses are bred to be ridden.",horses are bred to be ridden .,what horses are bred,what is bred to be ridden,what is true about horses
"Typically, hoes have been used to plow fields.",hoes have been used to plow fields .,what hoes have been used to do,what has been used to plow fields,what is true about hoes
"Typically, hoes are used to plow fields or clear snow.",hoes are used to plow fields or clear snow .,what hoes are used to do,what is used to plow fields or clear snow,what is true about hoes
"Typically, hair has a tendency to fall out.",hair has a tendency to fall out .,what hairs have,what has a tendency to fall out,what is true about hairs
"Typically, hair gels produce a smooth, shiny surface.","hair gels produce a smooth , shiny surface .",what hair gels produce,"what produces a smooth , shiny surface",what is true about hair gels
"Typically, hair clips are attached to the head.",hair clips are attached to the head .,what hair clips are attached to,what is attached to the head,what is true about hair clips
"Typically, hair clips are attached to the hair.",hair clips are attached to the hair .,what hair clips are attached to,what is attached to the hair,what is true about hair clips
"Typically, guns can be bought.",guns are bought .,what guns are,what is bought,what is true about guns
"Typically, frostbite produces pain, numbness, tingling, or weakness.","frostbite produces pain , numbness , tingling , or weakness .",what frostbites produce,"what produces pain , numbness , tingling , or weakness",what is true about frostbites
"Typically, experimental evidence is used to support or refute theories.",experimental evidence is used to support or refute theories .,what experimental evidences are used to do,what is used to support or refute theories,what is true about experimental evidences
"Typically, drummers are taught to play with their hands.",drummers are taught to play with their hands .,what drummers are taught to do,what is taught to play with their hands,what is true about drummers
"Typically, cudgels can be made of metal, wood, or other materials.","cudgels are made of metal , wood , or other materials .",what cudgels are made of,"what is made of metal , wood , or other materials",what is true about cudgels
"Typically, corrections are given to inmates who have committed serious crimes, including murder.","corrections are given to inmates who have committed serious crimes , including murder .",what corrections are given,"what is given to inmates who have committed serious crimes , including murder",what is true about corrections
"Typically, constipation may be treated with laxatives.",constipation is treated with laxatives .,what constipations are treated with,what is treated with laxatives,what is true about constipations
"Typically, cold storages are stored in the freezer.",cold storages are stored in the freezer .,where cold storages are stored,what is stored in the freezer,what is true about cold storages
"Typically, cold storage is used to preserve food for later use.",cold storage is used to preserve food for later use .,what cold storages are used to do,what is used to preserve food for later use,what is true about cold storages
"Typically, coincidences may be attributed to chance.",coincidences are attributed to chance .,what coincidences are attributed to,what is attributed to chance,what is true about coincidences
"Typically, coconut milk may have a higher fat content than other milks.",coconut milk has a higher fat content than other milks .,what coconut milks have,what has a higher fat content than other milks,what is true about coconut milks
"Typically, coasters are made of wood.",coasters are made of wood .,what coasters are made of,what is made of wood,what is true about coasters
"Typically, clocks are set to the local timezone.",clocks are set to the local timezone .,what clocks are set to,what is set to the local timezone,what is true about clocks
"Typically, cakes may have several layers.",cakes have several layers .,what cakes have,what has several layers,what is true about cakes
"Typically, cakes are made with a mix.",cakes are made with a mix .,what cakes are made with,what is made with a mix,what is true about cakes
"Typically, botany can be used to identify plants that are poisonous to humans.",botany is used to identify plants that are poisonous to humans .,what botanies are used to do,what is used to identify plants that are poisonous to humans,what is true about botanies
"Typically, bleaches may have adverse effects on the skin.",bleaches have adverse effects on the skin .,what bleaches have,what has adverse effects on the skin,what is true about bleaches
"Typically, bay leaves are used to flavor soups, stews, or sauces.","bay leaves are used to flavor soups , stews , or sauces .",what bay leaves are used to,"what is used to flavor soups , stews , or sauces",what is true about bay leaves
"Typically, backhoes can be used to dig trenches, but it is also possible to use them to remove debris.","backhoes are used to dig trenches , but it is also possible to use them to remove debris .",what backhoes are used to do,"what is used to dig trenches , but it is also possible to use them to remove debris",what is true about backhoes
"Typically, backhoes can be used to dig a hole.",backhoes are used to dig a hole .,what backhoes are used to do,what is used to dig a hole,what is true about backhoes
"Typically, apples are used to make cider, which is an alcoholic beverage.","apples are used to make cider , which is an alcoholic beverage .",what apples are used to do,"what is used to make cider , which is an alcoholic beverage",what is true about apples
"Typically, an x-ray produces an image.",an x - ray produces an image .,what x - rays produce,what produces an image,what is true about x - rays
"Typically, an orange should be kept in the refrigerator.",an orange is kept in the refrigerator .,where oranges are kept,what is kept in the refrigerator,what is true about oranges
"Typically, an ointment is applied directly to a cut.",an ointment is applied directly to a cut .,what ointments are applied directly,what is applied directly to a cut,what is true about ointments
"Typically, an iron deficiency produces anemia.",an iron deficiency produces anemia .,what iron deficiencies produce,what produces anemia,what is true about iron deficiencies
"Typically, an iron deficiency can be treated with iron supplementation.",an iron deficiency is treated with iron supplementation .,what iron deficiencies are treated with,what is treated with iron supplementation,what is true about iron deficiencies
"Typically, an herbivore may be able to consume a plant.",an herbivore is able to consume a plant .,what herbivores are able to do,what is able to consume a plant,what is true about herbivores
"Typically, an exhaust fan may have a fan blade.",an exhaust fan has a fan blade .,what exhaust fans have,what has a fan blade,what is true about exhaust fans
"Typically, an electrical connection can be used to connect a device to an external power source.",an electrical connection is used to connect a device to an external power source .,what electrical connections are used to,what is used to connect a device to an external power source,what is true about electrical connections
"Typically, an aquatic animal are able to survive in water.",an aquatic animal are able to survive in water .,what aquatic animals are able to do,what is able to survive in water,what is true about aquatic animals
"Typically, an aquatic animal are able to move through the water.",an aquatic animal are able to move through the water .,what aquatic animals are able to do,what is able to move through the water,what is true about aquatic animals
"Typically, an aloe can be used to treat burns.",an aloe is used to treat burns .,what aloes are used to do,what is used to treat burns,what is true about aloes
"Typically, ambulances can only take patients to the nearest hospital.",ambulances are able to only take patients to the nearest hospital .,what ambulances are able to do,what is able to only take patients to the nearest hospital,what is true about ambulances
"Typically, aloe can be considered to be a natural moisturizer.",aloe is a natural moisturizer .,what aloes are,what is a natural moisturizer,what is true about aloes
"Typically, alchemy can be used to create items.",alchemy is used to create items .,what alchemies are used to do,what is used to create items,what is true about alchemies
"Typically, abbeys have their own chapel.",abbeys have their own chapel .,what abbeys have,what has their own chapel,what is true about abbeys
"Typically, a zebra fish have the ability to swim.",a zebra fish have the ability to swim .,what zebra fish have,what has the ability to swim,what is true about zebra fish
"Typically, a whooping crane produces a sound.",a whooping crane produces a sound .,what whooping cranes produce,what produces a sound,what is true about whooping cranes
"Typically, a weightlifting should be performed with a barbell weight.",a weightlifting is performed with a barbell weight .,what weightliftings are performed with,what is performed with a barbell weight,what is true about weightliftings
"Typically, a weightlifting has to be done in a gym.",a weightlifting is done in a gym .,where weightliftings are done,what is done in a gym,what is true about weightliftings
"Typically, a water pump can be composed of several parts, including the pump housing.","a water pump is composed of several parts , including the pump housing .",what water pumps are composed of,"what is composed of several parts , including the pump housing",what is true about water pumps
"Typically, a water parks have a large pool.",a water parks have a large pool .,what water parks have,what has a large pool,what is true about water parks
"Typically, a water heater is connected to a water source.",a water heater is connected to a water source .,what water heaters are connected to,what is connected to a water source,what is true about water heaters
"Typically, a walleye may be caught by anglers who cast their line from the shore.",a walleye is caught by anglers who cast their line from the shore .,what walleyes are caught by,what is caught by anglers who cast their line from the shore,what is true about walleyes
"Typically, a triage can be used to determine if a patient needs to be admitted.",a triage is used to determine if a patient needs to be admitted .,what triages are used to do,what is used to determine if a patient needs to be admitted,what is true about triages
"Typically, a trembling is an involuntary spasm of the muscles.",a trembling is an involuntary spasm of the muscles .,what tremblings are an involuntary spasm of,what is an involuntary spasm of the muscles,what is true about tremblings
"Typically, a trembling is an involuntary spasm of muscles.",a trembling is an involuntary spasm of muscles .,what tremblings are an involuntary spasm of,what is an involuntary spasm of muscles,what is true about tremblings
"Typically, a toy chest can be opened.",a toy chest is opened .,what toy chests are,what is opened,what is true about toy chests
"Typically, a stimulant may have effects on the central nervous system.",a stimulant has effects on the central nervous system .,what stimulants have,what has effects on the central nervous system,what is true about stimulants
"Typically, a stamp produces an impression.",a stamp produces an impression .,what stamps produce,what produces an impression,what is true about stamps
"Typically, a stamp produces an impression on the paper.",a stamp produces an impression on the paper .,what stamps produce,what produces an impression on the paper,what is true about stamps
"Typically, a snow globes may have a base.",a snow globes have a base .,what snow globes have,what has a base,what is true about snow globes
"Typically, a small computer can be placed in a backpack.",a small computer is placed in a backpack .,where small computers are placed,what is placed in a backpack,what is true about small computers
"Typically, a small computer can be found in your home.",a small computer is found in your home .,where small computers are found,what is found in your home,what is true about small computers
"Typically, a skycap can be attached to an aircraft to provide the pilot with an unobstructed view.",a skycap is attached to an aircraft to provide the pilot with an unobstructed view .,what skycaps are attached to,what is attached to an aircraft to provide the pilot with an unobstructed view,what is true about skycaps
"Typically, a skunks produces an odor.",a skunks produces an odor .,what skunks produce,what produces an odor,what is true about skunks
"Typically, a sea snails may be found on the beach.",a sea snails are found on the beach .,what sea snails are found on,what is found on the beach,what is true about sea snails
"Typically, a scalpel may be used to cut the skin.",a scalpel is used to cut the skin .,what scalpels are used to do,what is used to cut the skin,what is true about scalpels
"Typically, a rose may be placed in a container with water.",a rose is placed in a container with water .,where roses are placed,what is placed in a container with water,what is true about roses
"Typically, a remote control may have a display screen.",a remote control has a display screen .,what remote controls have,what has a display screen,what is true about remote controls
"Typically, a remote control may be used to control a video game console.",a remote control is used to control a video game console .,what remote controls are used to do,what is used to control a video game console,what is true about remote controls
"Typically, a register has a maximum size.",a register has a maximum size .,what registers have,what has a maximum size,what is true about registers
"Typically, a pumpkins are harvested from the ground.",a pumpkins are harvested from the ground .,what pumpkins are harvested from,what is harvested from the ground,what is true about pumpkins
"Typically, a protein diet should consist of protein.",a protein diet consists of protein .,what protein diets consist of,what consists of protein,what is true about protein diets
"Typically, a processor should be able to run a program.",a processor is able to run a program .,what processors are able to do,what is able to run a program,what is true about processors
"Typically, a plane should be able to fly.",a plane is able to fly .,what planes are able to do,what is able to fly,what is true about planes
"Typically, a passion may be expressed by a single person, but may also be shared by many.","a passion is expressed by a single person , but may also be shared by many .",who passions are expressed by,"what is expressed by a single person , but may also be shared by many",what is true about passions
"Typically, a pancreas are located in the abdomen.",a pancreas are located in the abdomen .,where pancreas are located,what is located in the abdomen,what is true about pancreas
"Typically, a natural selection should be able to select for a trait.",a natural selection is able to select for a trait .,what natural selections are able to do,what is able to select for a trait,what is true about natural selections
"Typically, a monogram can be used to add a personal touch.",a monogram is used to add a personal touch .,what monograms are used to do,what is used to add a personal touch,what is true about monograms
"Typically, a middle finger may be used to convey a message to another.",a middle finger is used to convey a message to another .,what middle fingers are used to,what is used to convey a message to another,what is true about middle fingers
"Typically, a middle finger is a hand gesture used to express displeasure.",a middle finger is a hand gesture used to express displeasure .,what middle fingers are a hand gesture used to do,what is a hand gesture used to express displeasure,what is true about middle fingers
"Typically, a market should be able to sustain itself.",a market is able to sustain itself .,what markets are able to do,what is able to sustain itself,what is true about markets
"Typically, a mango tree are planted in the ground.",a mango tree are planted in the ground .,where mango trees are planted,what is planted in the ground,what is true about mango trees
"Typically, a lorries have a maximum weight capacity.",a lorries have a maximum weight capacity .,what lorries have,what has a maximum weight capacity,what is true about lorries
"Typically, a lightning has a diameter.",a lightning has a diameter .,what lightnings have,what has a diameter,what is true about lightnings
"Typically, a license plate should have a number.",a license plate has a number .,what license plates have,what has a number,what is true about license plates
"Typically, a lancet can be considered to be a surgical tool.",a lancet is a surgical tool .,what lancets are,what is a surgical tool,what is true about lancets
"Typically, a ill patient can be treated with antibiotics or other drugs.",a ill patient is treated with antibiotics or other drugs .,what ill patients are treated with,what is treated with antibiotics or other drugs,what is true about ill patients
"Typically, a hotel rooms have their own bathroom.",a hotel rooms have their own bathroom .,what hotel rooms have,what has their own bathroom,what is true about hotel rooms
"Typically, a helmet may have a visor.",a helmet has a visor .,what helmets have,what has a visor,what is true about helmets
"Typically, a hair gel can be purchased in a tube.",a hair gel is purchased in a tube .,where hair gels are purchased,what is purchased in a tube,what is true about hair gels
"Typically, a hair clips may be attached to the hair.",a hair clips are attached to the hair .,what hair clips are attached to,what is attached to the hair,what is true about hair clips
"Typically, a ground beetle may be found on the ground.",a ground beetle is found on the ground .,what ground beetles are found on,what is found on the ground,what is true about ground beetles
"Typically, a green vegetable may be added to a recipe to add color.",a green vegetable is added to a recipe to add color .,what green vegetables are added to,what is added to a recipe to add color,what is true about green vegetables
"Typically, a green vegetable can be eaten.",a green vegetable is eaten .,what green vegetables are,what is eaten,what is true about green vegetables
"Typically, a figure is used to represent a person, place, object, etc.","a figure is used to represent a person , place , object , etc .",what figures are used to do,"what is used to represent a person , place , object , etc",what is true about figures
"Typically, a drawers are used to store items that need to be put away.",a drawers are used to store items that need to be put away .,what drawers are used to do,what is used to store items that need to be put away,what is true about drawers
"Typically, a drawer may be used to store or hold materials.",a drawer is used to store or hold materials .,what drawers are used to do,what is used to store or hold materials,what is true about drawers
"Typically, a detergent may be used to clean.",a detergent is used to clean .,what detergents are used,what is used to clean,what is true about detergents
"Typically, a defense attorney should be able to get a conviction.",a defense attorney is able to get a conviction .,what defense attorneys are able to do,what is able to get a conviction,what is true about defense attorneys
"Typically, a decanter are used to fill a glass with water.",a decanter are used to fill a glass with water .,what decanters are used to,what is used to fill a glass with water,what is true about decanters
"Typically, a daybooks can consist of several pages.",a daybooks consists of several pages .,what daybooks consist of,what consists of several pages,what is true about daybooks
"Typically, a crabapples may be eaten fresh or dried.",a crabapples are eaten fresh or dried .,what crabapples are eaten,what is eaten fresh or dried,what is true about crabapples
"Typically, a constipation is caused by an obstruction in the digestive system.",a constipation is caused by an obstruction in the digestive system .,what constipations are caused by,what is caused by an obstruction in the digestive system,what is true about constipations
"Typically, a concert halls have at least two levels.",a concert halls have at least two levels .,what concert halls have,what has at least two levels,what is true about concert halls
"Typically, a concert hall may be used to house a concert.",a concert hall is used to house a concert .,what concert halls are used to do,what is used to house a concert,what is true about concert halls
"Typically, a comet should be bright enough to be seen with the unaided eye.",a comet is bright enough to be seen with the unaided eye .,what comets are bright,what is bright enough to be seen with the unaided eye,what is true about comets
"Typically, a chimpanzee should be able to pick up a tool.",a chimpanzee is able to pick up a tool .,what chimpanzees are able to do,what is able to pick up a tool,what is true about chimpanzees
